,doc_id,text,manu.couto1k_rels,marcosfp_rels,ezra.mario_rels,DavidGallego_rels,consensus,majority
123,350447,Vas a encontrarla y vas a tener la suerte que necesitas porque la mereces porque has luchado y porque te has ganado vivir esta vida que insisto merece la pena ,False,False,False,False,False,False
124,112625,te estas engañando no has contado nada te han pillado la ayuda de tus familiares no te servira pera nada mientras tu no tomes conciencia real te dejes de medias tintas cuentes la verdad cien por cien y te comprometas de verdad a tomar todas las medidas nesesarias te puede ocurrir algo que hemos pasado mas de uno nuestros familiares nos pilla les contamos lo que no nos queda mas remedio ellos se of...,True,True,False,False,False,False
125,235506,Si es cierto Alfonso que a nivel de pareja esta enfermedad pone en dudas muchas cosas la mentira por ejemplo es muy difícil de llevar ya que llegamos a pensar que puede que mienta para más temas que la enfermedad ,False,True,False,True,False,False
126,6643,Es posible que hayas dado este paso agobiado por tus deudas Pero la ludopatía te afecta mucho más allá de en tu economía La ludopatía transforma tu percepción de la realidad Y no la ludopatía no es un síntoma de algún otro trastorno ni tampoco una consecuencia de tu insatisfacción con tu vida La ludopatía es un trastorno psicologico causado por el gran poder adictivo de los distintos juegos La lud...,False,False,False,False,False,False
127,304885, Si sigues mintiendo u ocultando verdades mal asunto para ti y para tu familia ,True,True,True,False,False,True
128,126455,Confesar las barbaridades que has hecho escuchar a tu familia desconcertada a tus padres llorando ,False,False,False,False,False,False
129,495864,soportamos mentiras enganios ocultamientos manipulaciones deudas horas sin nuestras parejas no tenemos un futuro cierto sino incierto por que no sabemos si van a volver a jugar ,True,True,True,True,True,True
130,418297,11 Ha ocultado alguna vez a su pareja a sus hijos o a otros seres queridos boletos billetes de lotería ,False,False,False,False,False,False
131,465659,Segundo las mentiras del ludopata y la lastima de los familiares no sirven en esta enfermedad ,True,False,False,False,False,False
132,256764,Yo intento q mi hermana la vea como una enferma al resto de la familia se lo cuento ,False,False,False,False,False,False
133,93181,Y le hagas ver su situación y a la que conduce a su familia ,False,False,False,False,False,False
