,doc_id,text,manu.couto1k_rels,marcosfp_rels,ezra.mario_rels,DavidGallego_rels,consensus,majority
0,98560,La ludopatía tiene buen pronóstico en régimen ambulatorio es decir acudiendo a un grupo o asociación a las reuniones programadas y haciendo vida en tu casa con tu familia si la tienes en la calle y en tu trabajo con la condición de seguir las medidas preventivas a rajatabla ,False,False,False,False,False,False
1,442115,Y tú poder demostrarle a ella a quien tanto hemos ocultado de nuestra ludopata vida que todo va a ser distinto que ya no mas mentiras ,True,True,False,True,False,True
2,418052,11 Ha ocultado alguna vez a su pareja a sus hijos o a otros seres queridos boletos billetes de lotería ,True,False,False,False,False,False
3,66309,Deberías de plantearte si tu situación antisocial te la ha producido tu forma de ser o la ludopatia ,False,False,False,False,False,False
4,20486,Es posible que hayas dado este paso agobiado por tus deudas Pero la ludopatía te afecta mucho más allá de en tu economía La ludopatía transforma tu percepción de la realidad Y no la ludopatía no es un síntoma de algún otro trastorno ni tampoco una consecuencia de tu insatisfacción con tu vida La ludopatía es un trastorno psicologico causado por el gran poder adictivo de los distintos juegos La lud...,False,False,False,False,False,False
5,189450,Estás elaborando una enorme mentira hacia tí y tus padres ,True,False,False,False,False,False
6,190733,Nos ha mentido muchas veces no puede parar de jugar ha perdido a su familia ya que mis padres se han separado y para aumentar el problema acaba de abrir un bar ,True,True,True,True,True,True
7,47886,De las mentiras a los familiares ,False,False,False,False,False,False
8,11791,Es posible que hayas dado este paso agobiado por tus deudas Pero la ludopatía te afecta mucho más allá de en tu economía La ludopatía transforma tu percepción de la realidad Y no la ludopatía no es un síntoma de algún otro trastorno ni tampoco una consecuencia de tu insatisfacción con tu vida La ludopatía es un trastorno psicologico causado por el gran poder adictivo de los distintos juegos La lud...,False,False,False,False,False,False
9,48400,Has mentido ,False,False,False,False,False,False
10,37393, pero tú me llevas ventaja yo no sabía que era la ludopatía sólo me sentía el ser más despreciable sobre la tierra buscando préstamos para tapar otros préstamos descuidando el trabajo y a la familia incluso a mi persona ya ni me aseaba conservo alguna foto de aquella época con barbas descuidadas que llegaban casi hasta el suelo ,False,False,False,False,False,False
11,471313, Ha encontrado usted durante los últimos 12 meses que las apuestas más pequeñas son menos excitantes para usted que lo que eran antes ,False,False,False,False,False,False
12,233747,Esas personas que tienen una familia montada y se dejan todos los ahorros y destruyen la familia ,False,False,False,False,False,False
13,48406,Has mentido ,False,False,False,False,False,False
14,471328, Le ha mentido usted a miembros de su familia o a otras personas sobre cuánto ha jugado durante los últimos 12 meses ,True,False,False,False,False,False
15,237858,Tienes que ser consciente de la enfermedad que tiene tu marido esta enfermedad conlleva la mentira y es habitual en ellos ,True,False,True,True,False,True
16,466467,El ludopata es capaz de amar como cualquier otra persona ya veras que en el foro hay cantidad de jugadores que adoran a sus familias y otros que lamentan haberlas perdido ,False,False,False,False,False,False
17,471843,pues supongo que por el dia a dia en su vida en la que ha visto que dios no le ha ayudado para sacar adelante su vida y sus hijos De todas maneras tampoco pretendo que rectifiqueis de vuestras creencias cada uno es libre y yo no soy nadie ,False,False,False,False,False,False
18,57381,No voy a juzgar si no cenaste o si mentiste a tu familia es lo que hace un ludopata ,True,False,True,False,False,False
19,139302,El ludópata ha tenido que especializarse en la mentira y el engaño para conseguir dinero para jugar ,True,False,False,False,False,False
20,258598,Ya ha reconocido que es una ludópata ,False,False,False,False,False,False
21,124199,Si mentís a los demás los demás os pueden estar mintiendo a vosotros ,False,False,False,False,False,False
22,471337, Ha dependido usted en otras personas por ejemplo familia amigos o trabajo para que le provean dinero para cubrir sus deudas relacionadas con el juego ,False,False,False,False,False,False
23,233258,La ludopatia ha destrozado a muchas personas no sólo al jugador sino a los seres queridos nosotros no somos culpables de nuestra enfermedad pero si responsables de nuestra recuperación y si dicha abstención y recuperación debemos hacerla sólos pues adelante si lo hacemos con el apoyo de nuestra familia mejor pero la mayoria de los pasos debe hacerla el jugador pero repito con honestidad mente abie...,False,False,False,False,False,False
24,70183,Recordemos que la ludopatía en algunos caso llega a ser motivo incluo de diorcio o separaciones y los niños se dan cuenta e incluso pueden llegar a sentirse culpables ,False,False,False,False,False,False
25,475942,Luego a la inversa que el sepa lo que tu estás padeciendo y los efectos que causa en los familiares la ludopatia ,False,False,False,False,False,False
26,233261,la ludopatia es una enfermedad que trastorna todos nuestros valores como persona y los anula por lo tanto entiendo perfectamente que hayas decidido romper esa relacion si no te encuentras con fuerza para continuar es lo mejor para los dos se que es muy dificil despertarse y ver que el principe encantado se ha combertido en sapo ,False,False,False,False,False,False
27,472874,La mentira te ha llevado al juego y el juego te ha llevado a mentir mas ,True,False,False,False,False,False
28,340013,A mi esa reflexión de por qué mentia por qué ocultaba es lo que me hizo comprender que aparte de regalar mi dinero a gente más lista que yo gente que pasa todo el día pensando como hundirme con ánimo de lucro mentia y ocultaba para seguir haciendolo ,True,False,False,True,False,False
29,412208,Pero tambien se pasan en familia y eso es lo que somos una pequeña familia asi que ,False,False,False,False,False,False
30,453167,Bienvenida fortaleza si su pareja no reconoce el problema es muy dificil hacer algo si habla de llaves o sistemas de controlar el azar es la mente de una persona enferma en pleno funcionamiento y está muy equivocado la ludopatia frecuentemente arrastra a familias enteras a la ruina tenga cuidado ,False,False,False,False,False,False
31,404274,Mi vida siempre ha transcurrido feliz mi familia es estupenda y los amigos siempre han estado ahí nunca he tenido queja y creo ser un muy buena persona al menos con los demás conmigo mismo no tanto Mi falta de autoestima y mi incapacidad para satisfacerme me resultan bastante complicadas de mantener en el día a día ,False,False,False,False,False,False
32,353844,La ludopatia no sigue ese curso en su desarrollo se manifiesta comunmente con fases de control y represión intentos de abandono y recaidas recurrentes con aumentos más o menos prolongados de las dosis para que entiendas la naturaleza adictiva de este comportamiento y por supuesto tampoco es genético y ni lo uno ni lo otro tienen ninguna relación con poder mantener la abstinencia solos no veo el hi...,False,False,False,False,False,False
33,118582,Todos hemos mentido a la familia minimizando los gastos en juego e incluso algunos ni siquiera se han atrevido a confesar que juegan ,True,True,True,True,True,True
34,160569, solo haces preguntas y preguntas ,False,False,False,False,False,False
35,25914,La ludopatía va más allá que el jugar La ludopatía nos hace irracionales El ludopata con fuerza de voluntad puede estar un tiempo sin jugar pero manteniendo una lucha interna buscando alguna excusa para jugar He conocido gente que han jugado más de lo debido y no han desarrollado la adicción de modo que de repente han dejado de jugar sin más El ludopata tiene que reeducar su mente El ludopata si j...,False,False,False,False,False,False
36,51002,la ludopatia no es perder o ganar Puedes perder mucho y no ser ludopata Yo no sé si tú eres ludopata Si eres ludopata te estás equivocando la ludopatía es demasiado fuerte para vencerla como tú pretendes Tal vez no seas ludopata y solo has tenido un periodo de ofuscación que te ha provocado tu situación Pero si eres ludopata morirás ludopata la ludopatía no se cura Pero con un buen tratamiento apr...,False,False,False,False,False,False
37,51006,la ludopatia no es perder o ganar Puedes perder mucho y no ser ludopata Yo no sé si tú eres ludopata Si eres ludopata te estás equivocando la ludopatía es demasiado fuerte para vencerla como tú pretendes Tal vez no seas ludopata y solo has tenido un periodo de ofuscación que te ha provocado tu situación Pero si eres ludopata morirás ludopata la ludopatía no se cura Pero con un buen tratamiento apr...,False,False,False,False,False,False
38,320836,Hay personas que son mas orgullosas cuanto menos orgullo tienen ya sabes tapar mentiras con otras mentiras que el reconozca lo que es es el primer paso ,True,False,False,False,False,False
39,498501,Otros implicados en el mantenimiento de la ludopatía Debido al importante papel que en nuestro país juega la institución familiar los padres del jugador también se ven especialmente afectados y como ellos el resto de miembros de la familia hermanos hijos de hecho en un principio algunos jugadores recurren más a los padres que a su cónyuge para que no se entere con el interés de ocultar y resolver ...,True,False,False,False,False,False
40,130629,Primeramente conozco personas que tienen este transtorno de manera personal y que han sido partícipes de este y otros foros de ludopatía y lo último que hacen a día de hoy es estar totalmente alejados de los mismos precisamente porque han hecho borrón y cuenta nueva Si a ti te hace falta esto me parece estupendo por tu parte pero no creo que tú tengas un oráculo en tu casa para hablar de terceras ...,False,False,False,False,False,False
41,478279,Hola soy familiar de un ludopata que no quiere que nadie sepa nada de su enfermedad ,True,True,False,False,False,False
42,235851,Como mujer de ludópata mi consejo si puedo dar alguno es que no se lo ocultes a tu novia después de haber dado el paso de confesárselo y ver que te ofrece su ayuda no se merece que la envuelvas en más mentiras nadie puede decir que por saberlo la otra persona no vayas a caer de nuevo ,False,True,True,False,False,False
43,23123,puedes tener mil y un poblema puedes haber llegado a la ludopatia por dichos poblemas si has llegado a la ludopatia el arreglar los mil y un poblema no conlleba dejar de ser ludopata por supuesto que si un ludopata tiene otros trastornos debe de tratarlos al mismo tiempo pero la ludopatia es enfermedad y no sintoma de otra dolencia ,False,False,False,False,False,False
44,487765,les ha pasado alguna vez que se sientieron manipulados o seducidos por los ludopatas ,False,False,False,False,False,False
45,426336,quizas puedas escucharlos y entenderlos cada familiar tambien vive la ludopatia de diferente manera ,False,False,False,False,False,False
46,164452,De hecho son muchos los que viven en solitario su ludopatía no informando a sus familiares sobre ella sea por miedo vergüenza o cualquier otra causa ,False,True,False,False,False,False
47,193125,Lo que puedo decirte es que mi esposo al momento de enterarse sufrió mucho pero no más de lo que sufría sospechando mentiras engaños ,True,True,False,True,False,True
48,81510,Creo que la ludopatía es solo la antesala de la bipolaridad de hecho leí que en el 90 de los casos la ludopatía tiene un trastorno base más profundo entre ellos el trastorno de bipolaridad el obsesivo compulsivo y el de personalidad ,False,False,False,False,False,False
49,11879,Es posible que hayas dado este paso agobiado por tus deudas Pero la ludopatía te afecta mucho más allá de en tu economía La ludopatía transforma tu percepción de la realidad Y no la ludopatía no es un síntoma de algún otro trastorno ni tampoco una consecuencia de tu insatisfacción con tu vida La ludopatía es un trastorno psicologico causado por el gran poder adictivo de los distintos juegos La lud...,False,False,False,False,False,False
50,23145,puedes tener mil y un poblema puedes haber llegado a la ludopatia por dichos poblemas si has llegado a la ludopatia el arreglar los mil y un poblema no conlleba dejar de ser ludopata por supuesto que si un ludopata tiene otros trastornos debe de tratarlos al mismo tiempo pero la ludopatia es enfermedad y no sintoma de otra dolencia ,False,False,False,False,False,False
51,111722,a ver amigo ADICTOMAN el objetivo no es dejar de ser ludopata eso no va a ocurrir se trata de aprender a vivir sin jugar no se trata de vivir toda la vida con las medidas preventivas que nos impidan jugar supongo que habra a quien le cueste años conseguir poder vivir sin nesecidad de esas medidas y a otros solo algunos meses o incluso menos la cuestion es asegurarse de que uno esta totalmente reha...,False,False,False,False,False,False
52,344940,La ludopatía es una cosa y el carácter de las personas es otra distinta ,False,False,False,False,False,False
53,382836,Efectivamente deberias saber que el ludopata es un embustero compulsivo por tanto deberias saber que sarta de mentiras ha estado contando por ahi a sus padres a vuestros amigos etc ,True,True,False,False,False,False
54,125301,La ludopatía la drogadicción o el alcoholismo son trastornos del comportamiento en su mayoría de caracter adictivo ,False,False,False,False,False,False
55,71542,Alguien os ha insultado ó faltado al respeto ,False,False,False,False,False,False
56,292729,Por otro lado lo de tu familia procura solucionar lo que merece prioridad después quién te dice que no te independizas eso también rodará solo porque todo tiene su momento ánimo y fe en ti ,False,False,False,False,False,False
57,234874,Hace más o menos estoy leyendo sus relatos desde hace cerca de un mes ,False,False,False,False,False,False
58,299387,Nos ha mentido a todos familia e incluso el psicólogo al cual consultaba debido a su baja sociabilidad ,False,True,False,True,False,False
59,186236, Sigues mintiendo a tu familia ,False,True,False,False,False,False
60,355966,Gracias por entrar en un foro de ludopatía y compartir tú experiencia sj Se que nunca podré jugar de manera responsable ,False,False,False,False,False,False
61,470401,La ludopatía consiste en la incapacidad de la persona que juega para controlar su juego de tal modo que su forma de jugar y de perder afecta a áreas significativas de su vida salud economía familia trabajo amistades ,False,False,False,False,False,False
62,397953,Tu si lo estás haciendo informándote sobre la ludopatía y los estragos que hace con uno mismo y con los que le rodean ,False,False,False,False,False,False
63,426625,quizas puedas escucharlos y entenderlos cada familiar tambien vive la ludopatia de diferente manera ,False,False,False,False,False,False
64,86403,mentiras engaños y deudas eran el dia a dia me hacian sufrir y hacian sufrir a mi familia ,True,True,True,True,True,True
65,95366,Estar enfermo de ludopatia o de cualquier otra adiccion no significa estar a disposicion del consentimiento a las recaidas y eso es algo que pasa aqui casi constantemente es raro el dia que no recae alguien alguien que se atreve a decirlo aqui en el anonimato oculto y dispuesto a ser perdonado pero aqui que pasaria si se lo contara a su familia ,False,False,False,False,False,False
66,144007,He mentido a todo el mundo a mi familia a mi hijo a mi psicóloga a mi mismo ,True,True,True,True,True,True
67,203656,7 Te sientes mentiroso y manipulador con cualquier persona ,False,False,False,False,False,False
68,218761, Utilizas la mentira ante otros para esconder tu problema ,True,False,False,False,False,False
69,470410,La persona jugadora comienza a mentir a sus seres queridos para intentar ocultar sus problemas y a medida que sus mentiras se descubren aumentan los conflictos familiares las amenazas de separación los divorcios los problemas laborales y el aislamiento social ,True,False,True,False,False,False
70,340362,Amigo silencioso como te decia en el final de mi mensaje por el bien de nuestros hijos ojala eso ocurra algun día lamentablemente el gobierno sea cual sea su color o ideologia se preocupan más de otras adiciciones y no prestan importancia a la ludopatia siendo una enfermedad reconocida por la O M S y sabiendo como se sabe que hay cientos de personas que la padecen algunos abiertamente y otros se l...,False,False,False,False,False,False
71,409230,Un ludopata convierte su vida en una mentira se las tienen que ingeniar para ocultar siempre su verdadero yo su verdadera pasion el juego para ocultar su enfermedad ,True,False,True,False,False,False
72,481936,O la hay o no la hay ,False,False,False,False,False,False
73,480657,Las personas que sufren de ludopatía muchas veces se avergüenzan de ello e intentan que los demás no se enteren de su problema ,True,False,False,False,False,False
74,350866,Hola Esther que tal va todo ,False,False,False,False,False,False
75,405396,7 Ha engañado a su familia para ocultar la magnitud de su uso de Internet ,False,False,False,False,False,False
76,109205,mi familia no sabe nada es lo mas horroroso del mundo mentir mentir todo el dia diciendo mentiras me harte de mentir aqui esta la cuestion ellos estan pagando las consecuencias y tu por banidad no les das la oportunidad de luchar por lo que les pertenece cuando decimos que no implicamos a la familia por no darle un mal trago mentimos no lo hacemos porque no queremos mostrarnos ante ellos estas enf...,True,True,True,True,True,True
77,285333,ha separado a mi madre de su familia ,False,False,False,False,False,False
78,32408,La mentira va asociada a la ludopatía ,True,False,False,False,False,False
79,456092,Hay personas de todo tipo pero sin duda la ludopatía hace nacer o desarrolla notablemente las mentiras ,True,False,False,False,False,False
80,68770,En consecuencia hacia sus familias ,False,False,False,False,False,False
81,441764,Hola cris bienvenida mira yo tambien soy pareja de ludopata y a diferencia de tu pareja la mia no me conto que tenia problemas con el juego en teoria porque decia que no era consciente pero su familia tambien lo sabia y no me dijeron no me advirtieron tu al menos tienes la oportunidad de enfrentarte o dejarlo a tiempo es una decision muy personal y dificil cuando se esta enamorado por desgracia pa...,False,True,False,False,False,False
82,469926,La ludopatía es una enfermedad algunos la comparan con la diabetes yo la comparo con el cáncer es una adicción autodestructiva que en muchas ocasiones destruye a la persona y en otras arrastra a familiares se manifiesta por una incapacidad de la persona por dejar de jugar por sus propios medios necesita ayuda de profesionales en psicología y o psiquiatría medicación una asociación ayuda espiritual...,False,False,False,False,False,False
83,250791,La facilidad que me ha demostrado tener para mentirme me asusta y eso es lo último que quiero ,True,True,True,True,True,True
84,21672,Y El mentir no es una consecuencia de la ludopatía ,False,False,False,False,False,False
85,456105,Respecto al modo de tratarle y hacerle ver la clase de persona que es piensa que es un enfermo y muchas de sus mentiras son producidas por la ludopatía aunque no sólo en el campo del juego ,False,True,False,False,False,False
86,494250,Se engaña a los miembros de la familia terapeutas u otras personas para ocultar el grado de implicación en el juego ,False,False,True,False,False,False
87,87721,Eres un mentiroso ,False,False,False,False,False,False
88,358571,Busca ayuda en su familia haz que él la busque ,False,False,False,False,False,False
89,188335,Tu familia conoce tu enfermedad ,False,False,False,False,False,False
90,356018,No te martirices ha perdido una gran amiga Esther ,False,False,False,False,False,False
91,362675, El jugador miente compulsivamente para ocultar su problema ante los demás ,False,False,False,False,False,False
92,21682,Y El mentir no es una consecuencia de la ludopatía ,False,False,False,False,False,False
93,49333,Y para que salpique aún menos nadie de tu familia se enterará Esos con los que hablas en privado te han aconsejado que sueltes toda la mierda a tu familia ,False,False,False,False,False,False
94,474550,Has oido alguna noticia en la que digan que un ludopata se ha suicidado o matado a su mujer ,False,False,False,False,False,False
95,91575,La mente ludopata a veces piensa que se ha acabado pero en realidad es que salir de allí es mas difícil de lo que parece ,False,False,False,False,False,False
96,484020,Por el o ella por sus hermana y por su madre ,False,False,False,False,False,False
97,66493,Muy buena explicación de tu vivencia pues si la ludopatia mucha gente no sabe lo que es hasta que no loo vive en propia persona las veces que e tenido recaídas se lo e contado a mi madre y al principio me lo hechaba en cara pero las últimas veces no me dice mucho no se enfada ni nada y se que lo hace por si acaso me de por hacer alguna locura y esta vez que toque fondo saldré adelante ya que el ju...,False,False,False,False,False,False
98,471229, Ha violado usted la ley o considerado violar la ley para pagar por su juego ,False,False,False,False,False,False
99,203455,7 Te sientes mentiroso y manipulador con cualquier persona ,False,False,False,False,False,False
100,388551,mentra piadosa mentira para ocultar algo mentira para alardear mentir para mostrar seguridad ,True,False,False,False,False,False
101,421327,El que hace la ley hace la trampa y esa trampa da mucho dinero ,False,False,False,False,False,False
102,284111,y las mentiras que puedes llegar a decirle a tu familia a tus amigos y lo peor a TI MISMO ,True,True,True,False,False,True
103,318929,la union hace el poder desde que existe la vida unamosnos y hagamos algo para que al menos un pais como españa no haga cada dia mas ludopatas y cada vez mas jovenes como hay ,False,False,False,False,False,False
104,9938,La ludopatía es tan sólo un mecanismo vía método recurso o como le quieran llamar dónde la persona se engancha para liberar su malestar interno ,False,False,False,False,False,False
105,338897, He mentido descaradamente en mi entorno para mantener mi enfermedad oculta ,True,True,True,True,True,True
106,446164,Las personas con este trastorno tienden a mentir a sus familiares amigos médicos y psicólogos intentando minimizar su situación de juego patológico No hay para tanto dicen ,True,False,True,False,False,False
107,484133,Querida Maru te escribirí aqui para no tener que abrir un nuevo tema disculpa el mensaje pero creo igual que ya alguna ves te lo dije yo entiendo que la ludopatía es capaz de destruir familias por completo salud economía y mil cosas más pero porqué culpas en un 100 a la enfermedad tal vez el alejamiento de ustedes tenga que ver con otras cosas y no solo con la ludopatía tal ves él era así su forma...,False,False,False,False,False,False
108,15825,mentiras engaños y deudas eran el dia a dia me hacian sufrir y hacian sufrir a mi familia ,True,True,True,True,True,True
109,349144,Asi nos sentimos las mujeres de ludopatas con sus mentiras todo nos recuerda son sentimos traicionadas además tenemos unas faldas con colores en cada esquina un cajero cada dos pasos una excusa fácil en cualquier sitio ,True,True,True,True,True,True
110,207577,Al menos hasta la semana pasada que tuve una recaída y de las gordas ,False,False,False,False,False,False
111,288729,Tu marido no es un ludópata es la persona que tu amas con una ludopatía ,False,False,False,False,False,False
112,310235,Yo siempre he querido ocultar que soy ludopata pienso que la gente desconfiara de mi por ese motivo ,False,True,False,True,False,False
113,488413,y eso me DUELE que una persona que lo dado todo y más en esté FORO que sea SINCERA y diga como se siente diga la verdad o es mejor que mintiera que hubiera dicho yo creia y en sus inicios asi lo sentia que tenia un problema con la ludopatia y despues vea que su problema no llega digamos a ser ludopatia que es una pequeña evasión distraccíon que controla y aun no necesitando este foro para auto ayu...,False,False,False,False,False,False
114,58849,Dices que quieres acabar con las mentiras y ocultamientos y cambiar el estilo de vida pues empieza por ahí para empezar una rehabilitación en condiciones nada mejor que empezar a sincerarte con los tuyos ,True,True,True,True,True,True
115,56548,Si juega a escondidas miente a sabiendas de lo que ha pasado puede que no sea una ludopatia ,True,True,False,False,False,False
116,298981,AHORA QUE ESTA HACIENDO SU FAMILIA ,False,False,False,False,False,False
117,59367, Creéis que vuestra ludopatía podría estar motivada por algún tipo de mal trato mal ambiente familiar escolar o abuso en la infancia ,False,False,False,False,False,False
118,1511,o la ludopatia le hace a uno decir mentiras y luego no se acuerda que las dijo ,True,True,False,False,False,False
119,484586,etc a su familia pues en parte es como si me lo hicieran a mi pero esto es asi e insultando maltratando ,False,False,False,False,False,False
120,418026,para su ludopatía ,False,False,False,False,False,False
121,299756,La simple ocultación de la verdad a la familia comienza a crecer como bola de nieve hacia otras personas o instituciones donde la justificación para obtener el dinero tiene por base la mentira ,True,True,False,False,False,False
122,481260,Las personas ludópatas son muy propensas a cualquier otra adicción por lo que hay que tener extremo cuidado con éstas cosas ya que sí estás dejando de jugar pero ,False,False,False,False,False,False
