,doc_id,text,manu.couto1k_rels,marcosfp_rels,ezra.mario_rels,consensus,majority
114,332517,Yo cada dia te voy a preguntar si has jugado o no y tu me dices si si o si no ahora si es que si me dices que si y si es que no pues que no y porque has jugado y cuanto has ganado o perdido en funcion de tus respuestas si eres capaz de decir la verdad yo te demostrare que no te va a interesar jugar nunca solo vale si me dices la verdad si me dices que no has jugado y luego cuando hay que pagar las...,False,False,False,False,False
115,223718,cuando los jugadores o los familiares hablamos en pasado como tu tenia un problema el problema ha desaparecido se me ponen los pocos pelos que tengo como escarpias el problema no ha desaparecido esta ahi durmiendo esperando que que alguie lo despierte para vover a destrozarnos la vida ,False,False,False,False,False
116,136936,Te escribo para hacerte un pregunta el problema que yo tengo es que soy muy impulsivo y muy ansioso con lo cual me es muy dificil reprimir el impulso de jugar y como consecuencia juego y como siempre se pierde ,False,False,True,False,False
117,56556,mismo problema que tenía hace un año y que esto va a acabar mal aunque ahora solo apueste un par de euros ,False,False,False,False,False
118,45804,Quisiera debatir el por qué jugamos o jugabamos compulsivamente la gente con problemas en el juego ,False,False,False,False,False
119,177660,cuando no se puede jugar quieres hacerlo y te sientes mal cuando lo haces y lo pierdes todo tambien te sientes fatal ,False,False,False,False,False
120,447743, Siguio jugando a pesar de saber que aumentarian los problemas que estaba teniendo con otras personas como los miembros de su familia los amigos o su trabajo ,False,False,False,False,False
